{
  "course_id": "coffee-live-main",
  "artifact_type": "research_dossier",
  "produced_by_step": "research",
  "schema_version": "0.2",
  "status": "approved",
  "revision": 0,
  "revision_note": null,
  "inputs": [
    "brief",
    "course_outcomes"
  ],
  "updated_at": "2026-07-06T11:02:48+00:00",
  "body": {
    "research_scope": "Bounded competitor and factual-source research for Coffee making; competitor outlines inform structure, while only approved factual sources may ground learner content.",
    "competitor_findings": [
      {
        "id": "live_1",
        "provider": "www.coffeepodium.com",
        "offering": "BARISTA FUNDAMENTALS TRAINING - coffeepodium.com",
        "locator": "https://www.coffeepodium.com/courses/barista-fundamentals-training/",
        "audience": "Unknown from accessible page.",
        "level": "unknown",
        "duration": null,
        "delivery_format": null,
        "assessment_approach": null,
        "outline_status": "usable",
        "outline_sections": [
          {
            "id": "live_1_sec1",
            "order": 1,
            "raw_label": "Course Overview",
            "normalized_topic_id": "nt_course_overview",
            "locator": "https://www.coffeepodium.com/courses/barista-fundamentals-training/",
            "parent_label": "BARISTA FUNDAMENTALS TRAINING - coffeepodium.com"
          },
          {
            "id": "live_1_sec2",
            "order": 2,
            "raw_label": "Introduction to Coffee",
            "normalized_topic_id": "nt_introduction_to_coffee",
            "locator": "https://www.coffeepodium.com/courses/barista-fundamentals-training/",
            "parent_label": "BARISTA FUNDAMENTALS TRAINING - coffeepodium.com"
          },
          {
            "id": "live_1_sec3",
            "order": 3,
            "raw_label": "Coffee Origins",
            "normalized_topic_id": "nt_coffee_origins",
            "locator": "https://www.coffeepodium.com/courses/barista-fundamentals-training/",
            "parent_label": "BARISTA FUNDAMENTALS TRAINING - coffeepodium.com"
          },
          {
            "id": "live_1_sec4",
            "order": 4,
            "raw_label": "Arabica vs. Robusta",
            "normalized_topic_id": "nt_arabica_vs_robusta",
            "locator": "https://www.coffeepodium.com/courses/barista-fundamentals-training/",
            "parent_label": "BARISTA FUNDAMENTALS TRAINING - coffeepodium.com"
          },
          {
            "id": "live_1_sec5",
            "order": 5,
            "raw_label": "Sustainability in Coffee",
            "normalized_topic_id": "nt_sustainability_in_coffee",
            "locator": "https://www.coffeepodium.com/courses/barista-fundamentals-training/",
            "parent_label": "BARISTA FUNDAMENTALS TRAINING - coffeepodium.com"
          },
          {
            "id": "live_1_sec6",
            "order": 6,
            "raw_label": "Understanding Your Tools",
            "normalized_topic_id": "nt_understanding_your_tools",
            "locator": "https://www.coffeepodium.com/courses/barista-fundamentals-training/",
            "parent_label": "BARISTA FUNDAMENTALS TRAINING - coffeepodium.com"
          },
          {
            "id": "live_1_sec7",
            "order": 7,
            "raw_label": "Espresso Extraction",
            "normalized_topic_id": "nt_espresso_extraction",
            "locator": "https://www.coffeepodium.com/courses/barista-fundamentals-training/",
            "parent_label": "BARISTA FUNDAMENTALS TRAINING - coffeepodium.com"
          },
          {
            "id": "live_1_sec8",
            "order": 8,
            "raw_label": "Sensory Skills and Quality Control",
            "normalized_topic_id": "nt_sensory_skills_and_quality_control",
            "locator": "https://www.coffeepodium.com/courses/barista-fundamentals-training/",
            "parent_label": "BARISTA FUNDAMENTALS TRAINING - coffeepodium.com"
          },
          {
            "id": "live_1_sec9",
            "order": 9,
            "raw_label": "Tasting Techniques",
            "normalized_topic_id": "nt_tasting_techniques",
            "locator": "https://www.coffeepodium.com/courses/barista-fundamentals-training/",
            "parent_label": "BARISTA FUNDAMENTALS TRAINING - coffeepodium.com"
          },
          {
            "id": "live_1_sec10",
            "order": 10,
            "raw_label": "Consistency Checks",
            "normalized_topic_id": "nt_consistency_checks",
            "locator": "https://www.coffeepodium.com/courses/barista-fundamentals-training/",
            "parent_label": "BARISTA FUNDAMENTALS TRAINING - coffeepodium.com"
          },
          {
            "id": "live_1_sec11",
            "order": 11,
            "raw_label": "Milk Steaming techniques",
            "normalized_topic_id": "nt_milk_steaming_techniques",
            "locator": "https://www.coffeepodium.com/courses/barista-fundamentals-training/",
            "parent_label": "BARISTA FUNDAMENTALS TRAINING - coffeepodium.com"
          },
          {
            "id": "live_1_sec12",
            "order": 12,
            "raw_label": "Milk Texturing Basics",
            "normalized_topic_id": "nt_milk_texturing_basics",
            "locator": "https://www.coffeepodium.com/courses/barista-fundamentals-training/",
            "parent_label": "BARISTA FUNDAMENTALS TRAINING - coffeepodium.com"
          }
        ],
        "normalized_topic_ids": [
          "nt_course_overview",
          "nt_introduction_to_coffee",
          "nt_coffee_origins",
          "nt_arabica_vs_robusta",
          "nt_sustainability_in_coffee",
          "nt_understanding_your_tools",
          "nt_espresso_extraction",
          "nt_sensory_skills_and_quality_control",
          "nt_tasting_techniques",
          "nt_consistency_checks",
          "nt_milk_steaming_techniques",
          "nt_milk_texturing_basics"
        ],
        "structure_summary": "Moves from Course Overview toward Milk Texturing Basics across 12 visible sections.",
        "notable_topics": [
          "Course Overview",
          "Introduction to Coffee",
          "Coffee Origins",
          "Arabica vs. Robusta",
          "Sustainability in Coffee"
        ],
        "differentiation_opportunity": "Use the competitor common core as evidence, then tune scope to the approved brief."
      },
      {
        "id": "live_2",
        "provider": "www.scribd.com",
        "offering": "Barista Training Handbook | PDF | Coffee | Drink",
        "locator": "https://www.scribd.com/document/725101611/Free-Barista-Handbook-pdf",
        "audience": "Unknown from accessible page.",
        "level": "unknown",
        "duration": null,
        "delivery_format": null,
        "assessment_approach": null,
        "outline_status": "usable",
        "outline_sections": [
          {
            "id": "live_2_sec1",
            "order": 1,
            "raw_label": "Coffee cultivation",
            "normalized_topic_id": "nt_coffee_cultivation",
            "locator": "https://www.scribd.com/document/725101611/Free-Barista-Handbook-pdf",
            "parent_label": "Barista Training Handbook | PDF | Coffee | Drink"
          },
          {
            "id": "live_2_sec2",
            "order": 2,
            "raw_label": "Coffee varietals",
            "normalized_topic_id": "nt_coffee_varietals",
            "locator": "https://www.scribd.com/document/725101611/Free-Barista-Handbook-pdf",
            "parent_label": "Barista Training Handbook | PDF | Coffee | Drink"
          },
          {
            "id": "live_2_sec3",
            "order": 3,
            "raw_label": "Robusta vs Arabica",
            "normalized_topic_id": "nt_robusta_vs_arabica",
            "locator": "https://www.scribd.com/document/725101611/Free-Barista-Handbook-pdf",
            "parent_label": "Barista Training Handbook | PDF | Coffee | Drink"
          },
          {
            "id": "live_2_sec4",
            "order": 4,
            "raw_label": "Barista tools",
            "normalized_topic_id": "nt_barista_tools",
            "locator": "https://www.scribd.com/document/725101611/Free-Barista-Handbook-pdf",
            "parent_label": "Barista Training Handbook | PDF | Coffee | Drink"
          },
          {
            "id": "live_2_sec5",
            "order": 5,
            "raw_label": "Manual grinders",
            "normalized_topic_id": "nt_manual_grinders",
            "locator": "https://www.scribd.com/document/725101611/Free-Barista-Handbook-pdf",
            "parent_label": "Barista Training Handbook | PDF | Coffee | Drink"
          },
          {
            "id": "live_2_sec6",
            "order": 6,
            "raw_label": "Automatic grinders",
            "normalized_topic_id": "nt_automatic_grinders",
            "locator": "https://www.scribd.com/document/725101611/Free-Barista-Handbook-pdf",
            "parent_label": "Barista Training Handbook | PDF | Coffee | Drink"
          },
          {
            "id": "live_2_sec7",
            "order": 7,
            "raw_label": "Weighing coffee",
            "normalized_topic_id": "nt_weighing_coffee",
            "locator": "https://www.scribd.com/document/725101611/Free-Barista-Handbook-pdf",
            "parent_label": "Barista Training Handbook | PDF | Coffee | Drink"
          }
        ],
        "normalized_topic_ids": [
          "nt_coffee_cultivation",
          "nt_coffee_varietals",
          "nt_robusta_vs_arabica",
          "nt_barista_tools",
          "nt_manual_grinders",
          "nt_automatic_grinders",
          "nt_weighing_coffee"
        ],
        "structure_summary": "Moves from Coffee cultivation toward Weighing coffee across 7 visible sections.",
        "notable_topics": [
          "Coffee cultivation",
          "Coffee varietals",
          "Robusta vs Arabica",
          "Barista tools",
          "Manual grinders"
        ],